{
  "name": "banned-beat-sum-overfull",
  "tags": [
    "banned",
    "beats"
  ],
  "dsl": "title: T\nkey: C\ntime: 4/4\n[A]\n| C6 | C:3 G7:3 | A-7 | D7 Z\n",
  "expect": {
    "findings": [
      {
        "code": "beat-sum",
        "severity": "error",
        "line": 5,
        "message": "beats (3, 3) overflow a 4-beat bar"
      }
    ]
  }
}
