{
  "name": "banned-unbalanced-repeat-open",
  "tags": [
    "banned",
    "repeats"
  ],
  "dsl": "title: T\nkey: C\ntime: 4/4\n[A]\n{ | C6 | A-7 |\n",
  "expect": {
    "findings": [
      {
        "code": "unbalanced-repeat",
        "severity": "error",
        "line": 0,
        "message": "1 unclosed '{'"
      }
    ]
  }
}
