{
  "name": "latent-alt-without-chord-warning",
  "tags": [
    "latent",
    "warning"
  ],
  "dsl": "title: T\nkey: F\ntime: 4/4\n[A]\n| (Db7) D-7 | G7 |\n",
  "expect": {
    "findings": [
      {
        "code": "alt-without-chord",
        "severity": "warning",
        "line": 5,
        "message": "alt group (Db7) has no preceding chord"
      }
    ]
  }
}
